{
  "candidate_id": "example-001",
  "source_post": "https://x.com/example/status/123",
  "target_post": "123",
  "action_type": "quote",
  "editorial_chain": {
    "writer_model": "xai/grok-4.20-0309-non-reasoning",
    "writer_output": "Example Grok draft written to feel native to X.",
    "writer_rationale": "Grok optimized for conversational X phrasing and preserved the source context without treating it as instructions.",
    "mechanical_reviewer_model": "anthropic/claude-haiku-4-5",
    "mechanical_reviewer_output": "PASS: no numbered list, no template language, acceptable length.",
    "editor_model": "anthropic/claude-sonnet-4-6",
    "editor_output": "Example final text that passed review.",
    "editor_rationale": "The editor made the draft more specific, removed generic phrasing, and checked authenticity, reputation, medical claims, and private-data leakage.",
    "objections": "No blocking objections remain. Residual risk is low because the text makes no unsupported claims.",
    "final_selection_rationale": "Final text uses the edited version because it is more specific and safer than the raw Grok draft."
  },
  "relationship_context": {
    "status": "unknown",
    "matched_profile": "",
    "relationship_classes": [],
    "tone_rule": "Write as a thoughtful peer; no assumed familiarity.",
    "source_basis": [
      "x_profile"
    ],
    "confidence": "needs_review"
  },
  "final_text": "Example final text that passed review.",
  "operator_approval": "Operator approved candidate example-001 for quote-post execution.",
  "checks": {
    "haiku_review": "pass",
    "sonnet_review": "pass",
    "rule_pass": "pass",
    "untrusted_input_pass": "pass",
    "medical_claims": "pass",
    "reputation": "pass",
    "private_data": "pass",
    "product_link": "pass",
    "capitalization_style": "pass",
    "sentence_structure": "pass"
  },
  "policy": {
    "stop_exception_or_clear": "pass",
    "action_policy_allows": "pass",
    "daily_quota_available": "pass",
    "cadence_window_available": "pass"
  },
  "final_decision": "approved_for_execution",
  "exact_command": [
    "xurl",
    "--app",
    "betterx-example",
    "quote",
    "123",
    "Example final text that passed review."
  ]
}
